topic,label,size,share_%,coherence_cv,keywords
0,patriot · bless · patriots,223,5.25,0.4105,"patriot, bless, patriots, god bless, god, united, liberty, impeach potus, government, thank service"
1,rogers · updated · read carefully,148,3.48,0.5661,"rogers, updated, read carefully, roger, adapt, isnt, perfectly, add list, overcome, interesting"
3,map · future proves · proves past,124,2.92,0.4286,"map, future proves, proves past, proves, unlocks, news unlocks, future, past, timestamp, missing"
2,believe coincidences · coincidences · believe,120,2.82,0.3409,"believe coincidences, coincidences, believe, coincidences think, wonderful day, sept, coincidence, wonderful, enjoy believe, mathematically impossible"
7,fisa · signed · pg,117,2.75,0.3179,"fisa, signed, pg, placeholder, warrant, flynn, fisa warrant, firewalls, text, declas"
10,republican · fired · general,114,2.68,0.385,"republican, fired, general, democratic, director, child, attorney, huber, attorney general, fbi"
5,yes · aw · freedom,104,2.45,0.3148,"yes, aw, freedom, castle, ex, conf, stand freedom, 271, red, ok"
4,anons · anon · impressive,102,2.4,0.2637,"anons, anon, impressive, anons knew, pb, chandler, knew, thank anon, impressive impressive, feel proud"
9,attacks · cos · media cos,95,2.24,0.3777,"attacks, cos, media cos, wash post, attacked, cos world, movement, conspiracy, attack, biggest"
14,mueller · barr · evidence,95,2.24,0.5928,"mueller, barr, evidence, collusion, mueller designed, report, designed, investigation, blockade, schiff"
8,virus · c19 · biden,94,2.21,0.5397,"virus, c19, biden, virus election, death, unemployment, lockdown, benefits, positive, homes"
6,tweet · potus tweet · ss,91,2.14,0.3019,"tweet, potus tweet, ss, twitter, action, potus twitter, alice, emergency, response, min"
11,bank · central bank · donations,91,2.14,0.3821,"bank, central bank, donations, taxpayer, funds, money, central, blm, endless, net worth"
12,people stupid · stupid · hunted,79,1.86,0.2318,"people stupid, stupid, hunted, hunters hunted, hunters, sick, people sick, sick people, masks, restrict"
22,vigilant · fear · panic,79,1.86,0.4303,"vigilant, fear, panic, stop coming, look, removereplace, badge honor, badge, dead, visiting"
37,sa · huma · relevant,79,1.86,0.3737,"sa, huma, relevant, wonderland, bank, happened, donated, recently, money, alice wonderland"
17,wwg1wga wwg1wga · wwg1wga · ready,74,1.74,0.3571,"wwg1wga wwg1wga, wwg1wga, ready, memes ready, memes, deck, god wins, stand ready, attention, scott free"
15,hussein · isis · did hussein,73,1.72,0.2278,"hussein, isis, did hussein, backup, red cross, cross, pure evil, destroy, pure, red"
28,snowden · nsa · barlow,73,1.72,0.4315,"snowden, nsa, barlow, did snowden, truth power, es, guy, russia, surv, waiting"
30,cia · intelligence · departures think,72,1.69,0.2601,"cia, intelligence, departures think, floor, departures, spy, 187, central intelligence, cia central, intelligence agency"
23,ha · game · jack,69,1.62,0.377,"ha, game, jack, shall play, play game, king, play, abrams, game played, shall"
32,archive · operators · archive offline,66,1.55,0.3527,"archive, operators, archive offline, author, obvious, picture, corsi, 7th, 7th floor, offline"
21,viewpoint · control narrative · suppression,65,1.53,0.4313,"viewpoint, control narrative, suppression, divided, fact, news longer, fiction, free thought, echo, stable"
24,worth remembering · remembering · worth,65,1.53,0.4092,"worth remembering, remembering, worth, remember, sound familiar, week remember, sound, familiar, forget, insurgents"
27,knowingly · 000 · change believe,65,1.53,0.3474,"knowingly, 000, change believe, models, gang, votes, spider, spider web, seconds, privy gang"
18,black · party · black pop,63,1.48,0.3071,"black, party, black pop, welcome party, black community, racists, ds, propaganda arm, welcome, arm"
40,information warfare · warfare · information,62,1.46,0.3428,"information warfare, warfare, information, midnight, unknown, knowledge power, knowledge, expend ammunition, expend, ammunition"
34,nk · iran · nuke,61,1.44,0.427,"nk, iran, nuke, controls nk, hostage, nuclear, leverage, tech, weapons, missile"
47,panic dc · panic · dc,61,1.44,0.3895,"panic dc, panic, dc, interview, ohr, ll, date, meeting potus, talking, random"
13,error · disregard · spelling,59,1.39,0.3178,"error, disregard, spelling, mistakes, mistake, click, password, corrected, def, rulings"
26,truth people · tell public · truth,59,1.39,0.3902,"truth people, tell public, truth, people change, wake, people truth, public truth, happens people, truth right, memes memes"
20,coincidence coincidence · coincidence · amazing,58,1.37,0.4588,"coincidence coincidence, coincidence, amazing, initiated, coincidence think, durham, submission, review time, revised, coincidence amazing"
25,vip · patriot · eyes,58,1.37,0.4569,"vip, patriot, eyes, enjoy, rally, 55, patriots eyes, row, message sent, patriots"
46,watching · pen · world watching,57,1.34,0.4155,"watching, pen, world watching, single day, water, world connected, master, world, watching world, massive amounts"
19,trip · compromised · ip,54,1.27,0.3183,"trip, compromised, ip, update, trip code, dod, board, iden, code, verify"
35,does bird · bird · corona,54,1.27,0.2106,"does bird, bird, corona, bird sing, offline, sing, snow white, snow, christmas, goodbye"
61,msm · read lines · like clockwork,52,1.22,0.3695,"msm, read lines, like clockwork, 4am, clockwork, know know, es, addresses, lines, backchannels important"
44,test · 1111 · 10,51,1.2,0.3638,"test, 1111, 10, 710, does tell, choice, news today, infiltrated, np, 1st"
48,trust · listen carefully · trust plan,51,1.2,0.2265,"trust, listen carefully, trust plan, listen, kansas, trust sessions, carefully, wray, schedule, plan"
49,wwg1wga · stand wwg1wga · wwg1wga stand,51,1.2,0.3715,"wwg1wga, stand wwg1wga, wwg1wga stand, swift, win, unity, black forest, appreciative, fail wwg1wga, fight wwg1wga"
62,fake fake · fake · news fake,51,1.2,0.3595,"fake fake, fake, news fake, enemy people, fake news, media fun, trolling fake, news media, corsi, control remove"
33,board · comms · vital,50,1.18,0.4075,"board, comms, vital, cm, boards, madness, march madness, learn comms, private comms, private"
16,wwg1wga wwg1wga · wwg1wga · people wwg1wga,49,1.15,0.3305,"wwg1wga wwg1wga, wwg1wga, people wwg1wga, demonstrate resolve, wwg1wga people, week coincidence, usss, funeral, state funeral, resolve"
43,iran · deal · eu,49,1.15,0.2905,"iran, deal, eu, iran deal, covered, bank, gold, central, fears, sum fears"
36,epstein · rc · temple,48,1.13,0.4522,"epstein, rc, temple, circle, page, born, near, age, rbg, college"
38,boom · boom boom · week,48,1.13,0.3605,"boom, boom boom, week, booms, week ahead, boom week, weekend, tx, suicide, loudest"
57,china · darpa · trace,47,1.11,0.3081,"china, darpa, trace, fb, facebook, users, building, gps, bulk data, ceo"
56,senate · impeachment · holding,46,1.08,0.1783,"senate, impeachment, holding, ryan, paul ryan, paul, 5347, 23rd, systematic destruction, destruction old"
50,confirmed · happy hunting · happy,45,1.06,0.3703,"confirmed, happy hunting, happy, hunting, confirmed confirmed, shooter, kill, hammer, graphic confirmed, received"
31,voter · id · voter id,44,1.04,0.4498,"voter, id, voter id, vote, immigrants, vote vote, ballots, blank, elections, illegal"
29,armor · armor god · lord,43,1.01,0.6411,"armor, armor god, lord, spirit, evil, spiritual, blood, strong lord, god stand, devils"
41,test · sec · sat,43,1.01,0.4105,"test, sec, sat, device, hold, sec clearance, resolved, good movie, nz, line"
42,dark light · light · dark,43,1.01,0.2984,"dark light, light, dark, taught trust, darkness, darkness light, taught, kills, sun, pope"
52,symbolism · downfall · symbolism downfall,42,0.99,0.4256,"symbolism, downfall, symbolism downfall, owl, ask normal, cult, normal, conspiracy, head, shoes"
45,antifa · terrorism · violence,41,0.97,0.3403,"antifa, terrorism, violence, nazi, intimidation, insurgency, subversion, local, nullify challenge, challenge political"
39,odds · witnessed · standard deviation,40,0.94,0.3136,"odds, witnessed, standard deviation, mathematically, deviation, mathematically impossible, period time, impossible, standard, outside standard"
51,big big · watch news · handle,40,0.94,0.4536,"big big, watch news, handle, handle care, pp, big, watch, news week, dead, care"
60,divided · unity · party leader,40,0.94,0.2703,"divided, unity, party leader, class, time witnessed, want, religion, leader, strong, want divided"
-1,noise / outliers,38,0.89,,"farms, julian, produce, escapes, assange, fights, day days, funny, ginsburg, hooah"
54,awakening · great awakening · great,37,0.87,0.366,"awakening, great awakening, great, biblical, trigger, awakening wwg1wga, awakening great, mass pop, unseal, oct"
53,war continues · silent war · selling,36,0.85,0.5124,"war continues, silent war, selling, continues, silent, showers, pain coming, april showers, war, april"
55,love country · love · country,35,0.82,0.4241,"love country, love, country, armenia, honor, country remember, folks, faith god, country make, country want"
59,happening · pattern · notice pattern,34,0.8,0.5006,"happening, pattern, notice pattern, msdnc social, warning uk, chatter, departure, growing, warning, grand jury"
58,evil surrounds · surrounds · valid,31,0.73,0.3616,"evil surrounds, surrounds, valid, murder, ignorance, sense, common sense, excuse, crimes humanity, point"
