topic,label,size,share_%,coherence_cv,keywords
0,people · potus · think,4042,95.15,0.4787,"people, potus, think, did, news, control, public, does, power, fake"
-1,noise / outliers,67,1.58,,"love country, test, confirmed, sat, love, sec, happy hunting, hunting, country, confirmed confirmed"
1,anons · anon · anons knew,62,1.46,0.2655,"anons, anon, anons knew, impressive, knew, anons know, good anons, impressive impressive, thank anon, course"
2,wwg1wga wwg1wga · wwg1wga · visible,42,0.99,0.4362,"wwg1wga wwg1wga, wwg1wga, visible, answered, unitednotdivided wwg1wga, moment time, try harder, unitednotdivided, worldwide, match"
3,wwg1wga wwg1wga · wwg1wga · wwg1wga god,35,0.82,0.3068,"wwg1wga wwg1wga, wwg1wga, wwg1wga god, enjoyed, ben, wrwy, god wins, wins, thank, god"
